<?xml version="1.0" encoding="UTF-8"?>
<uml_class xmlns:xsi="http://www.w3.org/2001/XMLSchema-instance" xsi:noNamespaceSchemaLocation="-../xsd/UML_Class_Schema.xsd">
	<package name="creatures">
		<class name="Animal">
  	  <attribute name ="legs" visibility="-" data-type="integer" />
  	  <attribute name="eyes" visibility="-" data-type="integer" />
  	  <attribute name="weight" visibility="-" data-type="double" />
  	  <method name="eat" visibility="+" return-type="void">
  	    <parameter name="prey" data-type="Prey" />
  	  </method>
  	  <method name="sleep" visibility="+" return-type="void">
  	    <parameter name="hour" data-type="Integer" />
  	  </method>
  	  <method name="sound" visibility="+" return-type="void" />
  	</class>

		<class name="Prey">
			<attribute name="legs" visibility="-" data-type="integer" />
			<attribute name="eyes" visibility="-" data-type="integer" />
			<attribute name="weight" visibility="-" data-type="double" />
			<method name="sleep" visibility="+" return-type="void">
				<parameter name="hour" data-type="Integer" />
			</method>
			<method name="sound" visibility="+" return-type="void" />
		</class>

		<class name="Jaguar">
			<method name="run" visibility="+" return-type="void">
				<parameter name="pos" data-type="Position"/>
				<parameter name="speed" data-type="Integer"/>
			</method>
		</class>

		<class name="Bird">
			<method name="fly" visibility="+" return-type="void">
				<parameter name="pos" data-type="Position"/>
				<parameter name="speed" data-type="Integer"/>
			</method>
		</class>

		<class name="Cat">
			<method name="run" visibility="+" return-type="void">
				<parameter name="pos" data-type="Position"/>
				<parameter name="speed" data-type="Integer"/>
			</method>
		</class>

		<class name="Dog">
			<attribute name="legs" visibility="-" data-type="integer" />
			<method name="run" visibility="+" return-type="void">
				<parameter name="pos" data-type="Position"/>
				<parameter name="speed" data-type="Integer"/>
			</method>
		</class>

	</package>

	<relation type="inheritance">
		<class name="Bird" multiplicity="1"/>
		<toClass name="Animal" multiplicity = "3"/>
	</relation>

	<relation type="inheritance">
		<class name="Cat" multiplicity="1"/>
		<toClass name="Animal"/>
	</relation>

	<relation type="implementation">
		<class name="Jaguar" multiplicity="1"/>
		<toClass name="Cat"/>
	</relation>

	<relation type="composition">
		<class name="Cat" multiplicity="1"/>
		<toClass name="Prey"/>
	</relation>

	<relation type="aggregation">
		<class name="Dog" multiplicity="24"/>
		<toClass name="Cat"/>
	</relation>
</uml_class>
